{
  "object_type": "order",
  "contract_version": "0.2.0",
  "created_at": "2026-08-06T11:06:00Z",
  "order_id": "acp-order-0001",
  "merchant_ref": { "ref_type": "merchant", "id": "merchant-acp-001" },
  "cart_ref": { "ref_type": "cart", "id": "cart-acp-001" },
  "order_state": "created",
  "amount": { "currency_code": "USD", "value": "20.00" },
  "native": {
    "protocol_family": "ACP",
    "protocol_version": "1.0",
    "native_object_type": "OrderRecord",
    "digest": {
      "algorithm": "sha-256",
      "encoding": "hex",
      "value": "f7f7f7f7f7f7f7f7f7f7f7f7f7f7f7f7f7f7f7f7f7f7f7f7f7f7f7f7f7f7f7f7"
    },
    "custody": { "disposition": "caller_retained" },
    "captured_at": "2026-08-06T11:06:00Z"
  }
}
